[
  {
    "id": "aalto-main-dps",
    "name": "Aalto (Main-DPS)",
    "stars": 4,
    "attribute": "aero",
    "weapon": "pistols",
    "iconAsset": "assets/resonator_icons/aalto.webp",
    "portraitAsset": "assets/resonator_portraits/aalto.webp",
    "usableStats": ["critRate", "critDamage", "atkPercent", "flatAtk", "basicPercent", "skillPercent", "liberationPercent", "erPercent"],
    "teams": [],
    "erImportance": "Norm",
    "damageSplit": {
      "basic": 0.7,
      "heavy": 0.0,
      "skill": 0.15,
      "liberation": 0.1
    },
    "teamER": {
      "Default": {
        "min": 125.0,
        "max": 128.1
      }
    }
  },
  {
    "id": "aalto-sub-dps",
    "name": "Aalto (Sub-DPS)",
    "stars": 4,
    "attribute": "aero",
    "weapon": "pistols",
    "iconAsset": "assets/resonator_icons/aalto.webp",
    "portraitAsset": "assets/resonator_portraits/aalto.webp",
    "usableStats": ["critRate", "critDamage", "atkPercent", "flatAtk", "basicPercent", "skillPercent", "liberationPercent", "erPercent"],
    "teams": [],
    "erImportance": "Max",
    "damageSplit": {
      "basic": 0.45,
      "heavy": 0.0,
      "skill": 0.25,
      "liberation": 0.15
    },
    "teamER": {
      "Default": {
        "min": 125.0,
        "max": 128.1
      }
    }
  },
  {
    "id": "aemeath-fusion-burst",
    "name": "Aemeath (Fusion Burst)",
    "stars": 5,
    "attribute": "fusion",
    "weapon": "sword",
    "iconAsset": "assets/resonator_icons/aemeath.webp",
    "portraitAsset": "assets/resonator_portraits/aemeath.webp",
    "usableStats": ["critRate", "critDamage", "atkPercent", "flatAtk", "basicPercent", "liberationPercent", "erPercent"],
    "teams": ["Denia + Chisa/Lupa"],
    "erImportance": "Vital",
    "damageSplit": {
      "basic": 0.1,
      "heavy": 0.0,
      "skill": 0.0,
      "liberation": 0.85
    },
    "teamER": {
      "Default": {
        "min": 125.0,
        "max": 128.1
      },
      "Denia + Chisa/Lupa": {
        "min": 110.0,
        "max": 113.1
      }
    }
  },
  {
    "id": "aemeath-rupture",
    "name": "Aemeath (Rupture)",
    "stars": 5,
    "attribute": "fusion",
    "weapon": "sword",
    "iconAsset": "assets/resonator_icons/aemeath.webp",
    "portraitAsset": "assets/resonator_portraits/aemeath.webp",
    "usableStats": ["critRate", "critDamage", "atkPercent", "flatAtk", "basicPercent", "liberationPercent", "erPercent"],
    "teams": ["Lynae + Shorekeeper", "Lynae/Lupa + Mornye"],
    "erImportance": "Vital",
    "damageSplit": {
      "basic": 0.1,
      "heavy": 0.0,
      "skill": 0.0,
      "liberation": 0.85
    },
    "teamER": {
      "Default": {
        "min": 125.0,
        "max": 128.1
      },
      "Lynae + Shorekeeper": {
        "min": 120.0,
        "max": 123.1
      },
      "Lynae/Lupa + Mornye": {
        "min": 115.0,
        "max": 118.1
      }
    }
  },
  {
    "id": "augusta",
    "name": "Augusta",
    "stars": 5,
    "attribute": "electro",
    "weapon": "broadblade",
    "iconAsset": "assets/resonator_icons/augusta.webp",
    "portraitAsset": "assets/resonator_portraits/augusta.webp",
    "usableStats": ["critRate", "critDamage", "atkPercent", "flatAtk", "heavyPercent", "skillPercent", "erPercent"],
    "teams": ["Iuno + Shorekeeper", "Mortefi + Shorekeeper"],
    "erImportance": "Vital",
    "damageSplit": {
      "basic": 0.0,
      "heavy": 0.8,
      "skill": 0.15,
      "liberation": 0.0
    },
    "teamER": {
      "Default": {
        "min": 115.0,
        "max": 118.1
      },
      "Iuno + Shorekeeper": {
        "min": 125.0,
        "max": 128.1
      },
      "Mortefi + Shorekeeper": {
        "min": 115.0,
        "max": 118.1
      }
    }
  },
  {
    "id": "baizhi",
    "name": "Baizhi",
    "stars": 4,
    "attribute": "glacio",
    "weapon": "rectifier",
    "iconAsset": "assets/resonator_icons/baizhi.webp",
    "portraitAsset": "assets/resonator_portraits/baizhi.webp",
    "usableStats": ["hpPercent", "flatHp", "erPercent"],
    "teams": [],
    "erImportance": "Max",
    "damageSplit": {
      "basic": 0.0,
      "heavy": 0.0,
      "skill": 0.0,
      "liberation": 0.0
    },
    "teamER": {
      "Default": {
        "min": 230.0,
        "max": 233.1
      }
    }
  },
  {
    "id": "brant",
    "name": "Brant",
    "stars": 5,
    "attribute": "fusion",
    "weapon": "sword",
    "iconAsset": "assets/resonator_icons/brant.webp",
    "portraitAsset": "assets/resonator_portraits/brant.webp",
    "usableStats": ["critRate", "critDamage", "atkPercent", "flatAtk", "basicPercent", "liberationPercent", "erPercent"],
    "teams": [],
    "erImportance": "Max",
    "teamER": {
      "Default": {
        "min": 280.0,
        "max": 283.1
      }
    }
  },
  {
    "id": "buling",
    "name": "Buling",
    "stars": 4,
    "attribute": "electro",
    "weapon": "rectifier",
    "iconAsset": "assets/resonator_icons/buling.webp",
    "portraitAsset": "assets/resonator_portraits/buling.webp",
    "usableStats": ["critRate", "critDamage", "atkPercent", "flatAtk", "erPercent"],
    "teams": ["Carlotta", "Phrolova"],
    "erImportance": "Max",
    "damageSplit": {
      "basic": 0.0,
      "heavy": 0.0,
      "skill": 0.0,
      "liberation": 0.0
    },
    "teamER": {
      "Default": {
        "min": 135.0,
        "max": 138.1
      },
      "Carlotta": {
        "min": 125.0,
        "max": 128.1
      },
      "Phrolova": {
        "min": 135.0,
        "max": 138.1
      }
    }
  },
  {
    "id": "calcharo",
    "name": "Calcharo",
    "stars": 5,
    "attribute": "electro",
    "weapon": "broadblade",
    "iconAsset": "assets/resonator_icons/calcharo.webp",
    "portraitAsset": "assets/resonator_portraits/calcharo.webp",
    "usableStats": ["critRate", "critDamage", "atkPercent", "flatAtk", "basicPercent", "liberationPercent", "erPercent"],
    "teams": [],
    "erImportance": "Max",
    "damageSplit": {
      "basic": 0.25,
      "heavy": 0.0,
      "skill": 0.0,
      "liberation": 0.55
    },
    "teamER": {
      "Default": {
        "min": 125.0,
        "max": 128.1
      }
    }
  },
  {
    "id": "camellya",
    "name": "Camellya",
    "stars": 5,
    "attribute": "havoc",
    "weapon": "sword",
    "iconAsset": "assets/resonator_icons/camellya.webp",
    "portraitAsset": "assets/resonator_portraits/camellya.webp",
    "usableStats": ["critRate", "critDamage", "atkPercent", "flatAtk", "basicPercent", "liberationPercent", "erPercent"],
    "teams": ["Lynae + Shorekeeper", "Roccia + Shorekeeper"],
    "erImportance": "Norm",
    "damageSplit": {
      "basic": 0.75,
      "heavy": 0.0,
      "skill": 0.0,
      "liberation": 0.15
    },
    "teamER": {
      "Default": {
        "min": 115.0,
        "max": 118.1
      },
      "Lynae + Shorekeeper": {
        "min": 115.0,
        "max": 118.1
      },
      "Roccia + Shorekeeper": {
        "min": 125.0,
        "max": 128.1
      }
    }
  },
  {
    "id": "cantarella",
    "name": "Cantarella",
    "stars": 5,
    "attribute": "havoc",
    "weapon": "rectifier",
    "iconAsset": "assets/resonator_icons/cantarella.webp",
    "portraitAsset": "assets/resonator_portraits/cantarella.webp",
    "usableStats": ["critRate", "critDamage", "atkPercent", "flatAtk", "basicPercent", "skillPercent", "erPercent"],
    "teams": ["Midnight Veil (Phrolova + Roccia)", "Moonlit Clouds (Carlotta + Shorekeeper)"],
    "erImportance": "Max",
    "damageSplit": {
      "basic": 0.7,
      "heavy": 0.0,
      "skill": 0.1,
      "liberation": 0.0
    },
    "teamER": {
      "Default": {
        "min": 135.0,
        "max": 138.1
      },
      "Midnight Veil (Phrolova + Roccia)": {
        "min": 120.0,
        "max": 123.1
      },
      "Moonlit Clouds (Carlotta + Shorekeeper)": {
        "min": 140.0,
        "max": 143.1
      }
    }
  },
  {
    "id": "carlotta",
    "name": "Carlotta",
    "stars": 5,
    "attribute": "glacio",
    "weapon": "pistols",
    "iconAsset": "assets/resonator_icons/carlotta.webp",
    "portraitAsset": "assets/resonator_portraits/carlotta.webp",
    "usableStats": ["critRate", "critDamage", "atkPercent", "flatAtk", "skillPercent", "erPercent"],
    "teams": ["Zhezhi Outro"],
    "erImportance": "Vital",
    "damageSplit": {
      "basic": 0.0,
      "heavy": 0.0,
      "skill": 0.85,
      "liberation": 0.0
    },
    "teamER": {
      "Default": {
        "min": 125.0,
        "max": 128.1
      },
      "Zhezhi Outro": {
        "min": 110.0,
        "max": 113.1
      }
    }
  },
  {
    "id": "cartethyia",
    "name": "Cartethyia",
    "stars": 5,
    "attribute": "aero",
    "weapon": "sword",
    "iconAsset": "assets/resonator_icons/cartethyia.webp",
    "portraitAsset": "assets/resonator_portraits/cartethyia.webp",
    "usableStats": ["critRate", "critDamage", "hpPercent", "flatHp", "basicPercent", "skillPercent", "liberationPercent", "erPercent"],
    "teams": [],
    "erImportance": "Max",
    "damageSplit": {
      "basic": 0.55,
      "heavy": 0.0,
      "skill": 0.15,
      "liberation": 0.3
    },
    "teamER": {
      "Default": {
        "min": 110.0,
        "max": 113.1
      }
    }
  },
  {
    "id": "changli",
    "name": "Changli",
    "stars": 5,
    "attribute": "fusion",
    "weapon": "sword",
    "iconAsset": "assets/resonator_icons/changli.webp",
    "portraitAsset": "assets/resonator_portraits/changli.webp",
    "usableStats": ["critRate", "critDamage", "atkPercent", "flatAtk", "skillPercent", "liberationPercent", "erPercent"],
    "teams": ["Mono Fusion"],
    "erImportance": "Vital",
    "damageSplit": {
      "basic": 0.0,
      "heavy": 0.0,
      "skill": 0.65,
      "liberation": 0.3
    },
    "teamER": {
      "Default": {
        "min": 120.0,
        "max": 123.1
      },
      "Mono Fusion": {
        "min": 105.0,
        "max": 108.1
      }
    }
  },
  {
    "id": "chisa",
    "name": "Chisa",
    "stars": 5,
    "attribute": "havoc",
    "weapon": "broadblade",
    "iconAsset": "assets/resonator_icons/chisa.webp",